{
  "schema_version": "video-note/v2",
  "meta": {"platform": "example", "source_id": "jpeg", "source_url": "https://example.test/jpeg", "title": "JPEG", "author": "Author", "duration_seconds": 1, "language": "en"},
  "summary": "JPEG media.",
  "sections": [{"id": "jpeg", "title": "JPEG", "summary": "JPEG section.", "blocks": [{"id": "jpeg-media", "type": "media", "image": "media/frame.jpg", "alt": "JPEG image", "headline": "JPEG", "explanation": "A JPEG."}]}]
}
